"255223","2025-06-23","Amine Adli -","Amine Adliأمين عدلي","Amine Adli (born 10 May 2000) is a Moroccan footballer who plays as a striker for German club Bayer 04 Leverkusen, and the Morocco national team. In the game FC 25, his overall rating is 78.","https://cdn.sofifa.net/players/255/223/25_120.png","174","72","2000-05-09","SNT,SLO,MOO","78","82","€20.5M","€64K","Sol","3 ","4 ","1 ","","Zayıf","Evet","€35.4M","","32","Bayer 04 Leverkusen","19","Bundesliga","https://cdn.sofifa.net/meta/team/3321/30.png","83","SLOO","21","2021-08-25","2028","111111","Morocco","78","Friendly International","https://cdn.sofifa.net/meta/team/18551/30.png","79","SLO","21","129","Fas","https://cdn.sofifa.net/flags/ma.png","","","","","","","","","","","","","","","","","","","","","","","","","","","","","","","","","","",""
"255106","2025-06-23","Loïc Badé -"," Loïc Badé","Loïc Badé (born 11 April 2000) is a French footballer who plays as a center back for Spanish club Sevilla FC. In the game FC 25, his overall rating is 78.","https://cdn.sofifa.net/players/255/106/25_120.png","191","89","2000-04-10","STP","78","84","€20M","€28K","Sağ","3 ","2 ","1 ","","Zayıf","No","€46M","","481","Sevilla FC","53","La Liga","https://cdn.sofifa.net/meta/team/676/30.png","76","SĞMB","22","2023-06-30","2027","","","","","","","","","18","Fransa","https://cdn.sofifa.net/flags/fr.png","","","","","","","","","","","","","","","li","","","","","","","","","","","","","","","","","","","",""
"255009","2025-06-23","Kenneth Ina Dorothea Taylor -"," Kenneth Ina Dorothea Taylor","Kenneth Taylor (Kenneth Ina Dorothea Taylor, born 16 May 2002) is a Dutch footballer who plays as a center midfield for Dutch club Ajax, and the Netherlands national team. In the game FC 25, his overall rating is 78.","https://cdn.sofifa.net/players/255/009/25_120.png","182","73","2002-05-15","MO,MOO","78","84","€22.5M","€16K","Sol","5 ","3 ","1 ","","Normal (170-185)","Evet","€36M","","245","Ajax","10","Eredivisie","https://cdn.sofifa.net/meta/team/629/30.png","76","SLMO","8","2018-05-24","2027","105035","Netherlands","78","Friendly International","https://cdn.sofifa.net/meta/team/18694/30.png","83","YDK","26","34","Hollanda","https://cdn.sofifa.net/flags/nl.png","","","","","","","","","","","","","","","","","","","","","","","","","","","","","","","","","","",""
"254909","2025-06-23","Murphy Oscar Dorley -"," Murphy Oscar Dorley","Oscar Dorley (Murphy Oscar Dorley, born 19 July 1998) is a Liberian footballer who plays as a central defensive midfielder for Czech club SK Slavia Praha. In the game FC 25, his overall rating is 78.","https://cdn.sofifa.net/players/254/909/25_120.png","174","66","1998-07-18","MDO,MO","78","81","€17M","€28K","Sol","3 ","4 ","1 ","","Zayıf","No","€38.7M","","266","SK Slavia Praha","319","První liga","https://cdn.sofifa.net/meta/team/216/30.png","74","SLMO","19","2019-08-10","2027","","","","","","","","","122","Liberya","https://cdn.sofifa.net/flags/lr.png","","","","","","","","","","","","","","","li","","","","","","","","","","","","","","","","","","","",""
"254548","2025-06-23","Melvin Michel Maxence Bard -"," Melvin Michel Maxence Bard","Melvin Bard (Melvin Michel Maxence Bard, born 6 November 2000) is a French footballer who plays as a left back for French club OGC Nice. In the game FC 25, his overall rating is 78.","https://cdn.sofifa.net/players/254/548/25_120.png","173","65","2000-11-05","SLB,SLO,STP","78","82","€18.5M","€29K","Sol","3 ","3 ","1 ","","Normal (170-185)","Evet","€36.5M","","72","OGC Nice","16","Ligue 1","https://cdn.sofifa.net/meta/team/450/30.png","77","SLO","26","2021-07-30","2028","","","","","","","","","18","Fransa","https://cdn.sofifa.net/flags/fr.png","","","","","","","","","","","","","","","li","","","","","","","","","","","","","","","","","","","",""
"253727","2025-06-23","Lukáš Provod -"," Lukáš Provod","Lukáš Provod (born 23 October 1996) is a Czech footballer who plays as a central attacking midfielder for Czech club SK Slavia Praha, and the Czechia national team. In the game FC 25, his overall rating is 78.","https://cdn.sofifa.net/players/253/727/25_120.png","191","85","1996-10-22","MOO,MO,SLO","78","78","€15M","€32K","Sol","4 ","3 ","1 ","","Normal (185+)","No","€33M","","266","SK Slavia Praha","319","První liga","https://cdn.sofifa.net/meta/team/216/30.png","74","SĞOO","17","2019-09-01","2029","1330","Czechia","78","Friendly International","https://cdn.sofifa.net/meta/team/18718/30.png","76","SLK","14","12","Çek Cumhuriyeti","https://cdn.sofifa.net/flags/cz.png","","","","","","","","","","","","","","","Oyun KurliGezici","","","","","","","","","","","","","","","","","","","",""
"253473","2025-06-23","Samuele Ricci -"," Samuele Ricci","Samuele Ricci (born 21 August 2001) is an Italian footballer who plays as a center midfield for Italian club Torino, and the Italy national team. In the game FC 25, his overall rating is 78.","https://cdn.sofifa.net/players/253/473/25_120.png","181","76","2001-08-20","MO,MDO","78","85","€28.5M","€42K","Sağ","3 ","3 ","1 ","","Normal (170-185)","Evet","€54.2M","","54","Torino","31","Serie A","https://cdn.sofifa.net/meta/team/613/30.png","76","SĞDO","28","2022-06-30","2028","1343","Italy","78","Friendly International","https://cdn.sofifa.net/meta/team/18658/30.png","82","MDO","6","27","İtalya","https://cdn.sofifa.net/flags/it.png","","","","","","","","","","","","","","","li","","","","","","","","","","","","","","","","","","","",""
"253396","2025-06-23","Giuliano Simeone Baldini -"," Giuliano Simeone Baldini","Giuliano Simeone (Giuliano Simeone Baldini, born 18 December 2002) is an Argentine footballer who plays as a right midfield for Spanish club Atlético Madrid. In the game FC 25, his overall rating is 78.","https://cdn.sofifa.net/players/253/396/25_120.png","173","75","2002-12-17","SĞO,SNT,SLO","78","84","€22.5M","€43K","Sağ","3 ","3 ","1 ","","Normal (170-185)","No","€51.8M","Sprinter","240","Atlético Madrid","53","La Liga","https://cdn.sofifa.net/meta/team/7980/30.png","82","SĞO","22","2020-09-02","2028","","","","","","","","","52","Arjantin","https://cdn.sofifa.net/flags/ar.png","","","","","","","","","","","","","","","liHücum Yap","","","","","","","","","","","","","","","","","","","",""
"253124","2025-06-23","Matheus Nunes -"," Matheus Luiz Nunes","Matheus Nunes (born 27 August 1998) is a Portuguese footballer who plays as a right back for British club Manchester City. In the game FC 25, his overall rating is 78.","https://cdn.sofifa.net/players/253/124/25_120.png","184","78","1998-08-26","SĞB,MO","78","80","€16M","€95K","Sağ","3 ","3 ","1 ","","Zayıf","No","€30.8M","","10","Manchester City","13","Premier League","https://cdn.sofifa.net/meta/team/9/30.png","85","SĞB","27","2023-08-31","2028","","","","","","","","","38","Portekiz","https://cdn.sofifa.net/flags/pt.png","","","","","","","","","","","","","","","liHücum Yap","","","","","","","","","","","","","","","","","","","",""
"253002","2025-06-23","Giacomo Raspadori -"," Giacomo Raspadori","Giacomo Raspadori (born 18 February 2000) is an Italian footballer who plays as a central attacking midfielder for Italian club Napoli, and the Italy national team. In the game FC 25, his overall rating is 78.","https://cdn.sofifa.net/players/253/002/25_120.png","172","69","2000-02-17","MOO,SNT,SLK","78","83","€21M","€80K","Sağ","5 ","4 ","2 ","","Normal (170-185)","Evet","€37.3M","","48","Napoli","31","Serie A","https://cdn.sofifa.net/meta/team/597/30.png","79","SLK","81","2023-06-30","2028","1343","Italy","78","Friendly International","https://cdn.sofifa.net/meta/team/18658/30.png","82","SLST","10","27","İtalya","https://cdn.sofifa.net/flags/it.png","","","","","","","","","","","","","","","Oyun KurliGezici","","","","","","","","","","","","","","","","","","","",""
"252324","2025-06-23","Riquelme -"," Rodrigo Riquelme Reche","Riquelme (born 2 April 2000) is a Spanish footballer who plays as a left midfield for Spanish club Atlético Madrid. In the game FC 25, his overall rating is 78.","https://cdn.sofifa.net/players/252/324/25_120.png","174","68","2000-04-01","SLO,SĞO,SLB","78","81","€19M","€51K","Sağ","3 ","3 ","1 ","","Zayıf","Evet","€41.3M","","240","Atlético Madrid","53","La Liga","https://cdn.sofifa.net/meta/team/7980/30.png","82","YDK","17","2019-06-30","2028","","","","","","","","","45","İspanya","https://cdn.sofifa.net/flags/es.png","","","","","","","","","","","","","","","liHücum Yap","","","","","","","","","","","","","","","","","","","",""
"252259","2025-06-23","Enzo Camille Alain Millot -"," Enzo Camille Alain Millot","Enzo Millot (Enzo Camille Alain Millot, born 17 July 2002) is a French footballer who plays as a central attacking midfielder for German club VfB Stuttgart. In the game FC 25, his overall rating is 78.","https://cdn.sofifa.net/players/252/259/25_120.png","174","66","2002-07-16","MOO,MO","78","84","€22.5M","€23K","Sol","2 ","4 ","1 ","","Zayıf","Evet","€42.8M","","36","VfB Stuttgart","19","Bundesliga","https://cdn.sofifa.net/meta/team/3319/30.png","77","YDK","8","2021-08-13","2028","","","","","","","","","18","Fransa","https://cdn.sofifa.net/flags/fr.png","","","","","","","","","","","","","","","Oyun KurliGezici","","","","","","","","","","","","","","","","","","","",""
"252143","2025-06-23","Daniel Bragança -"," Daniel Santos Bragança","Daniel Bragança (born 27 May 1999) is a Portuguese footballer who plays as a center midfield for Portuguese club Sporting CP. In the game FC 25, his overall rating is 78.","https://cdn.sofifa.net/players/252/143/25_120.png","178","72","1999-05-26","MO,MDO,MOO","78","81","€18.5M","€15K","Sol","3 ","4 ","1 ","","Zayıf","No","€38.4M","","237","Sporting CP","308","Primeira Liga","https://cdn.sofifa.net/meta/team/58/30.png","79","YDK","23","2018-06-30","2027","","","","","","","","","38","Portekiz","https://cdn.sofifa.net/flags/pt.png","","","","","","","","","","","","","","","Oyun KurliGezici","","","","","","","","","","","","","","","","","","","",""
"252037","2025-06-23","Fábio Silva -"," Fábio Daniel Soares Silva","Fábio Silva (born 19 July 2002) is a Portuguese footballer who plays as a striker for Spanish club UD Las Palmas, on loan from Wolverhampton Wanderers. In the game FC 25, his overall rating is 78.","https://cdn.sofifa.net/players/252/037/25_120.png","185","75","2002-07-18","SNT,SLK","78","85","€29M","€53K","Sağ","3 ","4 ","1 ","","Zayıf","Evet","","","472","UD Las Palmas","53","La Liga","https://cdn.sofifa.net/meta/team/2921/30.png","75","SNT","37","","30 Haz 2025","","","","","","","","","38","Portekiz","https://cdn.sofifa.net/flags/pt.png","","","","","","","","","","","","","","","Hücum YapliGezici","","","","","","","","","","","","","","","","","","","",""
"251810","2025-06-23","Brian Ebenezer Adjei Brobbey -"," Brian Ebenezer Adjei Brobbey","Brian Brobbey (Brian Ebenezer Adjei Brobbey, born 1 February 2002) is a Dutch footballer who plays as a striker for Dutch club Ajax, and the Netherlands national team. In the game FC 25, his overall rating is 78.","https://cdn.sofifa.net/players/251/810/25_120.png","180","78","2002-01-31","SNT","78","84","€23M","€18K","Sağ","4 ","3 ","1 ","","Yapılı","Evet","€36.8M","Güçlü","245","Ajax","10","Eredivisie","https://cdn.sofifa.net/meta/team/629/30.png","76","SNT","9","2022-07-21","2027","105035","Netherlands","78","Friendly International","https://cdn.sofifa.net/meta/team/18694/30.png","83","YDK","9","34","Hollanda","https://cdn.sofifa.net/flags/nl.png","","","","","","","","","","","","","","","","","","","","","","","","","","","","","","","","","","",""
"251804","2025-06-23","Sergiño Gianni Dest -"," Sergiño Gianni Dest","Sergiño Dest (Sergiño Gianni Dest, born 3 November 2000) is an American soccer player who plays as a left back for Dutch club PSV, and the United States national team. In the game FC 25, his overall rating is 78.","https://cdn.sofifa.net/players/251/804/25_120.png","173","68","2000-11-02","SLB,SĞB","78","83","€20M","€14K","Sağ","4 ","4 ","1 ","","Normal (170-185)","Evet","€29.5M","","247","PSV","10","Eredivisie","https://cdn.sofifa.net/meta/team/682/30.png","78","YDK","8","2024-06-30","2028","1387","United States","78","Friendly International","https://cdn.sofifa.net/meta/team/18571/30.png","77","YDK","2","95","ABD","https://cdn.sofifa.net/flags/us.png","","","","","","","","","","","","","","","liHücum Yap","","","","","","","","","","","","","","","","","","","",""
"251573","2025-06-23","Renan Lodi -"," Renan Augusto Lodi dos Santos","Renan Lodi (born 8 April 1998) is a Brazilian footballer who plays as a left back for Saudi Arabian club Al Hilal. In the game FC 25, his overall rating is 78.","https://cdn.sofifa.net/players/251/573/25_120.png","173","68","1998-04-07","SLB","78","79","€15M","€40K","Sol","3 ","4 ","1 ","","Zayıf","Evet","€25.1M","","605","Al Hilal","350","Pro League","https://cdn.sofifa.net/meta/team/7011/30.png","77","SLB","6","2024-01-16","2027","","","","","","","","","54","Brezilya","https://cdn.sofifa.net/flags/br.png","","","","","","","","","","","","","","","liHücum Yap","","","","","","","","","","","","","","","","","","","",""
"251377","2025-06-23","Rodrigo Zalazar Martínez -"," Rodrigo Zalazar Martínez","Rodrigo Zalazar (Rodrigo Zalazar Martínez, born 12 August 1999) is a Uruguayan footballer who plays as a center midfield for Portuguese club Sporting Clube de Braga. In the game FC 25, his overall rating is 78.","https://cdn.sofifa.net/players/251/377/25_120.png","178","70","1999-08-11","MO,MOO,MDO","78","82","€20M","€15K","Sağ","4 ","3 ","1 ","","Normal (170-185)","Evet","€43.5M","","1896","Sporting Clube de Braga","308","Primeira Liga","https://cdn.sofifa.net/meta/team/884/30.png","74","MOO","16","2023-07-13","2028","","","","","","","","","60","Uruguay","https://cdn.sofifa.net/flags/uy.png","","","","","","","","","","","","","","","Hücum Yapli","","","","","","","","","","","","","","","","","","","",""
"250955","2025-06-23","Josip Stanišić -"," Josip Stanišić","Josip Stanišić (born 2 April 2000) is a Croatian footballer who plays as a right back for German club FC Bayern München, and the Croatia national team. In the game FC 25, his overall rating is 78.","https://cdn.sofifa.net/players/250/955/25_120.png","187","77","2000-04-01","SĞB,STP","78","82","€18.5M","€46K","Sağ","4 ","2 ","1 ","","Zayıf","Evet","€31.9M","","21","FC Bayern München","19","Bundesliga","https://cdn.sofifa.net/meta/team/503/30.png","84","YDK","44","2021-04-09","2029","1328","Croatia","78","Friendly International","https://cdn.sofifa.net/meta/team/18588/30.png","79","SĞB","2","10","Hırvatistan","https://cdn.sofifa.net/flags/hr.png","","","","","","","","","","","","","","","Savunli","","","","","","","","","","","","","","","","","","","",""
"250723","2025-06-23","Kouadio Emmanuel Boris Koné -"," Kouadio Emmanuel Boris Koné","Kouadio Manu Koné (Kouadio Emmanuel Boris Koné, born 17 May 2001) is a French footballer who plays as a center midfield for Italian club Roma, on loan from Borussia Mönchengladbach, and the France national team. In the game FC 25, his overall rating is 78.","https://cdn.sofifa.net/players/250/723/25_120.png","185","80","2001-05-16","MO,MDO","78","84","€22M","€27K","Sağ","3 ","4 ","2 ","","Zayıf","Evet","","","52","Roma","31","Serie A","https://cdn.sofifa.net/meta/team/37/30.png","79","SLMO","17","","30 Haz 2025","1335","France","78","Friendly International","https://cdn.sofifa.net/meta/team/18647/30.png","85","SLMO","24","18","Fransa","https://cdn.sofifa.net/flags/fr.png","","","","","","","","","","","","","","","li","","","","","","","","","","","","","","","","","","","",""
"248793","2025-06-23","Mats Wieffer -"," Mats Wieffer","Mats Wieffer (born 16 November 1999) is a Dutch footballer who plays as a central defensive midfielder for British club Brighton & Hove Albion. In the game FC 25, his overall rating is 78.","https://cdn.sofifa.net/players/248/793/25_120.png","188","78","1999-11-15","MDO,MO","78","82","€18.5M","€67K","Sağ","3 ","3 ","1 ","","Zayıf","Evet","€36.5M","","1808","Brighton & Hove Albion","13","Premier League","https://cdn.sofifa.net/meta/team/78/30.png","78","YDK","27","2024-07-04","2029","","","","","","","","","34","Hollanda","https://cdn.sofifa.net/flags/nl.png","","","","","","","","","","","","","","","li","","","","","","","","","","","","","","","","","","","",""
"248484","2025-06-23","Nathan Michael Collins -"," Nathan Michael Collins","Nathan Collins (Nathan Michael Collins, born 30 April 2001) is an Irish footballer who plays as a center back for British club Brentford, and the Republic of Ireland national team. In the game FC 25, his overall rating is 78.","https://cdn.sofifa.net/players/248/484/25_120.png","193","81","2001-04-29","STP","78","82","€18M","€56K","Sağ","3 ","2 ","1 ","","Normal (185+)","Evet","€35.6M","","1925","Brentford","13","Premier League","https://cdn.sofifa.net/meta/team/236/30.png","77","SĞMB","22","2023-07-03","2029","1355","Republic of Ireland","78","Friendly International","https://cdn.sofifa.net/meta/team/18654/30.png","74","SĞMB","22","25","İrlanda Cumhuriyeti","https://cdn.sofifa.net/flags/ie.png","","","","","","","","","","","","","","","Savunli","","","","","","","","","","","","","","","","","","","",""
"248266","2025-06-23","Sacha Boey -"," Sacha Boey","Sacha Boey (born 13 September 2000) is a French footballer who plays as a right back for German club FC Bayern München. In the game FC 25, his overall rating is 78.","https://cdn.sofifa.net/players/248/266/25_120.png","178","76","2000-09-12","SĞB","78","81","€18M","€46K","Sağ","3 ","3 ","1 ","","Normal (170-185)","Evet","€31.1M","","21","FC Bayern München","19","Bundesliga","https://cdn.sofifa.net/meta/team/503/30.png","84","YDK","23","2024-01-27","2028","","","","","","","","","18","Fransa","https://cdn.sofifa.net/flags/fr.png","","","","","","","","","","","","","","","liHücum Yap","","","","","","","","","","","","","","","","","","","",""
"247832","2025-06-23","Thierry Correia -"," Thierry Rendall Correia","Thierry Correia (born 9 March 1999) is a Portuguese footballer who plays as a right back for Spanish club Valencia CF. In the game FC 25, his overall rating is 78.","https://cdn.sofifa.net/players/247/832/25_120.png","176","69","1999-03-08","SĞB,SLB","78","81","€17M","€38K","Sağ","4 ","3 ","1 ","","Normal (170-185)","Evet","€37M","Sprinter","461","Valencia CF","53","La Liga","https://cdn.sofifa.net/meta/team/214/30.png","77","REZ","26","2019-09-01","2026","","","","","","","","","38","Portekiz","https://cdn.sofifa.net/flags/pt.png","","","","","","","","","","","","","","","li","","","","","","","","","","","","","","","","","","","",""
"247495","2025-06-23","Moncayola -"," Jon Moncayola Tollar","Moncayola (born 13 May 1998) is a Spanish footballer who plays as a center midfield for Spanish club CA Osasuna. In the game FC 25, his overall rating is 78.","https://cdn.sofifa.net/players/247/495/25_120.png","182","78","1998-05-12","MO,MDO,SĞB","78","79","€16.5M","€35K","Sağ","4 ","3 ","1 ","","Zayıf","Evet","€35.9M","","479","CA Osasuna","53","La Liga","https://cdn.sofifa.net/meta/team/459/30.png","77","SLMO","7","2017-06-30","2031","","","","","","","","","45","İspanya","https://cdn.sofifa.net/flags/es.png","","","","","","","","","","","","","","","li","","","","","","","","","","","","","","","","","","","",""
"247182","2025-06-23","Tuta -"," Lucas Silva Melo","Tuta (born 4 July 1999) is a Brazilian footballer who plays as a center back for German club Eintracht Frankfurt. In the game FC 25, his overall rating is 78.","https://cdn.sofifa.net/players/247/182/25_120.png","185","81","1999-07-03","STP,MDO","78","80","€16M","€32K","Sağ","2 ","2 ","2 ","","Normal (185+)","Evet","€28.4M","","1824","Eintracht Frankfurt","19","Bundesliga","https://cdn.sofifa.net/meta/team/366/30.png","77","SĞMB","35","2019-01-30","2026","","","","","","","","","54","Brezilya","https://cdn.sofifa.net/flags/br.png","","","","","","","","","","","","","","","li","","","","","","","","","","","","","","","","","","","",""
"246928","2025-06-23","Iván Martín -"," Iván Martín Núñez","Iván Martín (born 14 February 1999) is a Spanish footballer who plays as a center midfield for Spanish club Girona FC. In the game FC 25, his overall rating is 78.","https://cdn.sofifa.net/players/246/928/25_120.png","178","70","1999-02-13","MO,MDO,MOO","78","81","€18.5M","€32K","Sol","3 ","3 ","1 ","","Normal (170-185)","Evet","€40.2M","","110062","Girona FC","53","La Liga","https://cdn.sofifa.net/meta/team/231/30.png","78","MOO","23","2023-07-21","2028","","","","","","","","","45","İspanya","https://cdn.sofifa.net/flags/es.png","","","","","","","","","","","","","","","","","","","","","","","","","","","","","","","","","","",""
"246923","2025-06-23","Jacob Matthew Ramsey -"," Jacob Matthew Ramsey","Jacob Ramsey (Jacob Matthew Ramsey, born 21 May 2001) is a British footballer who plays as a left midfield for British club Aston Villa. In the game FC 25, his overall rating is 78.","https://cdn.sofifa.net/players/246/923/25_120.png","180","72","2001-05-20","SLO","78","82","€20M","€81K","Sağ","4 ","3 ","1 ","","Normal (170-185)","Evet","€39.5M","","2","Aston Villa","13","Premier League","https://cdn.sofifa.net/meta/team/15/30.png","81","SLO","41","2017-06-30","2027","","","","","","","","","14","İngiltere","https://cdn.sofifa.net/flags/gb-eng.png","","","","","","","","","","","","","","","liHücum Yap","","","","","","","","","","","","","","","","","","","",""
"246565","2025-06-23","Bafodé Diakité -"," Bafodé Diakité","Bafodé Diakité (born 6 January 2001) is a French footballer who plays as a center back for French club Lille OSC. In the game FC 25, his overall rating is 78.","https://cdn.sofifa.net/players/246/565/25_120.png","184","82","2001-01-05","STP,SĞB","78","83","€19M","€29K","Sağ","4 ","2 ","1 ","","Normal (170-185)","Evet","€37.5M","","65","Lille OSC","16","Ligue 1","https://cdn.sofifa.net/meta/team/690/30.png","77","SĞMB","18","2022-08-04","2028","","","","","","","","","18","Fransa","https://cdn.sofifa.net/flags/fr.png","","","","","","","","","","","","","","","li","","","","","","","","","","","","","","","","","","","",""
"246321","2025-06-23","Daizen Maeda -","Daizen Maeda前田 大然","Daizen Maeda (born 20 October 1997) is a Japanese footballer who plays as a left winger for Scottish club Celtic. In the game FC 25, his overall rating is 78.","https://cdn.sofifa.net/players/246/321/25_120.png","173","68","1997-10-19","SLK,SNT,SĞK","78","78","€15.5M","€59K","Sağ","4 ","2 ","1 ","","Zayıf","Evet","€26.4M","Sprinter,akrobat","78","Celtic","50","Premiership","https://cdn.sofifa.net/meta/team/53/30.png","75","SLK","38","2022-06-06","2027","","","","","","","","","163","Japonya","https://cdn.sofifa.net/flags/jp.png","","","","","","","","","","","","","","","Hücum YapliGezici","","","","","","","","","","","","","","","","","","","",""
"246174","2025-06-23","Harvey Scott Elliott -"," Harvey Scott Elliott","Harvey Elliott (Harvey Scott Elliott, born 4 April 2003) is a British footballer who plays as a central attacking midfielder for British club Liverpool. In the game FC 25, his overall rating is 78.","https://cdn.sofifa.net/players/246/174/25_120.png","168","64","2003-04-03","MOO,MO,SĞK","78","86","€31.5M","€61K","Sol","3 ","4 ","1 ","","Normal (170-185)","Evet","€64.6M","akrobat","9","Liverpool","13","Premier League","https://cdn.sofifa.net/meta/team/8/30.png","84","YDK","19","2019-07-27","2027","","","","","","","","","14","İngiltere","https://cdn.sofifa.net/flags/gb-eng.png","","","","","","","","","","","","","","","Oyun KurliGezici","","","","","","","","","","","","","","","","","","","",""
"245637","2025-06-23","Georginio Rutter -"," Georginio Rutter","Georginio Rutter (born 20 April 2002) is a French footballer who plays as a central attacking midfielder for British club Brighton & Hove Albion. In the game FC 25, his overall rating is 78.","https://cdn.sofifa.net/players/245/637/25_120.png","182","83","2002-04-19","MOO,SNT","78","84","€22.5M","€72K","Sol","5 ","5 ","1 ","","Normal (170-185)","Evet","€47.3M","","1808","Brighton & Hove Albion","13","Premier League","https://cdn.sofifa.net/meta/team/78/30.png","78","REZ","14","2024-08-18","2029","","","","","","","","","18","Fransa","https://cdn.sofifa.net/flags/fr.png","","","","","","","","","","","","","","","Oyun KurliGezici","","","","","","","","","","","","","","","","","","","",""
"245037","2025-06-23","Eric García -"," Eric García Martret","Eric García (born 9 January 2001) is a Spanish footballer who plays as a center back for Spanish club FC Barcelona. In the game FC 25, his overall rating is 78.","https://cdn.sofifa.net/players/245/037/25_120.png","182","76","2001-01-08","STP,SĞB,MDO","78","83","€19M","€80K","Sağ","3 ","2 ","2 ","","Normal (170-185)","Evet","€40.4M","","241","FC Barcelona","53","La Liga","https://cdn.sofifa.net/meta/team/83/30.png","84","YDK","24","2021-06-30","2026","","","","","","","","","45","İspanya","https://cdn.sofifa.net/flags/es.png","","","","","","","","","","","","","","","li","","","","","","","","","","","","","","","","","","","",""
